### ISSUE TITLE
RFLink with LAN interface can't reconnect after network interruption

### ISSUE THREAD

**Issue by Whizzzer** [domoticz/domoticz#770]
When the network between the Domoticz server and RFLink over LAN interface was interrupted for a (short) amount of time, Domoticz can't reconnect automatically to the RFLink over LAN although it says it is trying to do so.

The only workaround is to go to the Hardware tab, unselect "Enabled", save it, select "Enabled" and save it again.

Please see the output below and guess when I did this workaround:
2016-08-04 13:04:31.738 RFLink: trying to connect to 10.0.70.7:10000
2016-08-04 13:05:01.741 RFLink: trying to connect to 10.0.70.7:10000
2016-08-04 13:05:31.743 RFLink: trying to connect to 10.0.70.7:10000
2016-08-04 13:06:01.746 RFLink: trying to connect to 10.0.70.7:10000
2016-08-04 13:06:31.748 RFLink: trying to connect to 10.0.70.7:10000
2016-08-04 13:07:01.750 RFLink: trying to connect to 10.0.70.7:10000
2016-08-04 13:07:31.753 RFLink: trying to connect to 10.0.70.7:10000
2016-08-04 13:08:01.756 RFLink: trying to connect to 10.0.70.7:10000
2016-08-04 13:08:31.759 RFLink: trying to connect to 10.0.70.7:10000
2016-08-04 13:09:00.762 RFLink: TCP/IP Worker stopped...
2016-08-04 13:09:12.136 RFLink: trying to connect to 10.0.70.7:10000
2016-08-04 13:09:13.137 RFLink: connected to: 10.0.70.7:10000

I looked with tcpdump on my Domoticz machine. Though Domoticz says it is trying to reconnect to the RFLink over LAN at port 10000, no traffic towards the RFLink over LAN is generated.

O, I've also tested with rebooting the device which is the actual RFLink over LAN, but this did not help. Obviously because the problem is at the Domoticz side where no traffic is generated anymore towards the RFLink over LAN.

**Comment by Whizzzer** [comment]
As requested in issue #769, tried to see if it was fixed.. Unfortunately not.

I used tcpdump on both ends (so the domoticz server and the RFLink over LAN (which is actually a Raspberry Pi running Jessie and the default ser2net package) and the traffic pattern is identical. Therefore I will only use the tcpdump output of the Domoticz server.

First, this is what Domoticz shows, including the workaround of disabling and enabling the RFLink:
2016-08-08 08:18:48.027 RFLink: trying to connect to rpi-garage.home.intra:10000
2016-08-08 08:19:18.032 RFLink: trying to connect to rpi-garage.home.intra:10000
2016-08-08 08:19:48.035 RFLink: trying to connect to rpi-garage.home.intra:10000
2016-08-08 08:20:18.039 RFLink: trying to connect to rpi-garage.home.intra:10000
2016-08-08 08:20:48.050 RFLink: trying to connect to rpi-garage.home.intra:10000
2016-08-08 08:21:18.053 RFLink: trying to connect to rpi-garage.home.intra:10000
2016-08-08 08:21:48.057 RFLink: trying to connect to rpi-garage.home.intra:10000
2016-08-08 08:22:18.061 RFLink: trying to connect to rpi-garage.home.intra:10000
2016-08-08 08:22:48.064 RFLink: trying to connect to rpi-garage.home.intra:10000
2016-08-08 08:23:08.067 RFLink: TCP/IP Worker stopped...
2016-08-08 08:23:25.238 RFLink: trying to connect to rpi-garage.home.intra:10000
2016-08-08 08:23:26.239 RFLink: connected to: rpi-garage.home.intra:10000

The tcpdump output starts at 08:22, just to focus on the problem parts.. 

dennis@domoticz:~$ sudo tcpdump -i eth0 host rpi-garage.home.intra and not port 22 and not arp
tcpdump: verbose output suppressed, use -v or -vv for full protocol decode
listening on eth0, link-type EN10MB (Ethernet), capture size 262144 bytes
08:22:17.279449 IP domoticz.home.intra > rpi-garage.home.intra: ICMP echo request, id 2992, seq 1, length 27
08:22:17.280757 IP rpi-garage.home.intra > domoticz.home.intra: ICMP echo reply, id 2992, seq 1, length 27
08:22:28.354096 IP rpi-garage.home.intra.webmin > domoticz.home.intra.53042: Flags [P.], seq 90541001:90541033, ack 1123433770, win 227, options [nop,nop,TS val 172273728 ecr 17555652], length 32
08:22:28.354125 IP domoticz.home.intra.53042 > rpi-garage.home.intra.webmin: Flags [.], ack 32, win 237, options [nop,nop,TS val 17561935 ecr 172273728], length 0
08:22:28.357104 IP rpi-garage.home.intra.webmin > domoticz.home.intra.53042: Flags [P.], seq 32:43, ack 1, win 227, options [nop,nop,TS val 172273729 ecr 17561935], length 11
08:22:28.395781 IP domoticz.home.intra.53042 > rpi-garage.home.intra.webmin: Flags [.], ack 43, win 237, options [nop,nop,TS val 17561946 ecr 172273729], length 0
08:22:29.289273 IP domoticz.home.intra > rpi-garage.home.intra: ICMP echo request, id 2992, seq 1, length 27
08:22:29.290798 IP rpi-garage.home.intra > domoticz.home.intra: ICMP echo reply, id 2992, seq 1, length 27
08:22:38.180480 IP rpi-garage.home.intra.webmin > domoticz.home.intra.53042: Flags [P.], seq 43:75, ack 1, win 227, options [nop,nop,TS val 172274711 ecr 17561946], length 32
08:22:38.180505 IP domoticz.home.intra.53042 > rpi-garage.home.intra.webmin: Flags [.], ack 75, win 237, options [nop,nop,TS val 17564392 ecr 172274711], length 0
08:22:38.182921 IP rpi-garage.home.intra.webmin > domoticz.home.intra.53042: Flags [P.], seq 75:86, ack 1, win 227, options [nop,nop,TS val 172274711 ecr 17564392], length 11
08:22:38.219767 IP domoticz.home.intra.53042 > rpi-garage.home.intra.webmin: Flags [.], ack 86, win 237, options [nop,nop,TS val 17564402 ecr 172274711], length 0
08:22:41.317399 IP domoticz.home.intra > rpi-garage.home.intra: ICMP echo request, id 2992, seq 1, length 27
08:22:41.322423 IP rpi-garage.home.intra > domoticz.home.intra: ICMP echo reply, id 2992, seq 1, length 27
08:22:53.330515 IP domoticz.home.intra > rpi-garage.home.intra: ICMP echo request, id 2992, seq 1, length 27
08:22:53.332496 IP rpi-garage.home.intra > domoticz.home.intra: ICMP echo reply, id 2992, seq 1, length 27
08:23:03.352079 IP rpi-garage.home.intra.webmin > domoticz.home.intra.53042: Flags [P.], seq 86:118, ack 1, win 227, options [nop,nop,TS val 172277228 ecr 17564402], length 32
08:23:03.352109 IP domoticz.home.intra.53042 > rpi-garage.home.intra.webmin: Flags [.], ack 118, win 237, options [nop,nop,TS val 17570685 ecr 172277228], length 0
08:23:03.357807 IP rpi-garage.home.intra.webmin > domoticz.home.intra.53042: Flags [P.], seq 118:129, ack 1, win 227, options [nop,nop,TS val 172277229 ecr 17570685], length 11
08:23:03.395765 IP domoticz.home.intra.53042 > rpi-garage.home.intra.webmin: Flags [.], ack 129, win 237, options [nop,nop,TS val 17570696 ecr 172277229], length 0
08:23:05.311223 IP domoticz.home.intra > rpi-garage.home.intra: ICMP echo request, id 2992, seq 1, length 27
08:23:05.469898 IP rpi-garage.home.intra > domoticz.home.intra: ICMP echo reply, id 2992, seq 1, length 27
08:23:08.067301 IP domoticz.home.intra.53042 > rpi-garage.home.intra.webmin: Flags [R.], seq 1, ack 129, win 237, options [nop,nop,TS val 17571863 ecr 172277229], length 0
08:23:17.513011 IP domoticz.home.intra > rpi-garage.home.intra: ICMP echo request, id 2992, seq 1, length 27
08:23:17.519373 IP rpi-garage.home.intra > domoticz.home.intra: ICMP echo reply, id 2992, seq 1, length 27
08:23:25.239049 IP domoticz.home.intra.37534 > rpi-garage.home.intra.webmin: Flags [S], seq 3168533619, win 29200, options [mss 1460,sackOK,TS val 17576156 ecr 0,nop,wscale 7], length 0
08:23:25.244373 IP rpi-garage.home.intra.webmin > domoticz.home.intra.37534: Flags [S.], seq 3802273918, ack 3168533620, win 28960, options [mss 1460,sackOK,TS val 172279417 ecr 17576156,nop,wscale 7], length 0
08:23:25.244405 IP domoticz.home.intra.37534 > rpi-garage.home.intra.webmin: Flags [.], ack 1, win 229, options [nop,nop,TS val 17576158 ecr 172279417], length 0
08:23:25.256662 IP rpi-garage.home.intra.webmin > domoticz.home.intra.37534: Flags [P.], seq 1:33, ack 1, win 227, options [nop,nop,TS val 172279418 ecr 17576158], length 32
08:23:25.256685 IP domoticz.home.intra.37534 > rpi-garage.home.intra.webmin: Flags [.], ack 33, win 229, options [nop,nop,TS val 17576161 ecr 172279418], length 0
08:23:26.177004 IP rpi-garage.home.intra.webmin > domoticz.home.intra.37534: Flags [P.], seq 33:65, ack 1, win 227, options [nop,nop,TS val 172279510 ecr 17576161], length 32
08:23:26.177032 IP domoticz.home.intra.37534 > rpi-garage.home.intra.webmin: Flags [.], ack 65, win 229, options [nop,nop,TS val 17576391 ecr 172279510], length 0
08:23:26.181795 IP rpi-garage.home.intra.webmin > domoticz.home.intra.37534: Flags [P.], seq 65:93, ack 1, win 227, options [nop,nop,TS val 172279511 ecr 17576391], length 28
08:23:26.181818 IP domoticz.home.intra.37534 > rpi-garage.home.intra.webmin: Flags [.], ack 93, win 229, options [nop,nop,TS val 17576392 ecr 172279511], length 0
08:23:26.239406 IP domoticz.home.intra.37534 > rpi-garage.home.intra.webmin: Flags [P.], seq 1:10, ack 93, win 229, options [nop,nop,TS val 17576406 ecr 172279511], length 9
08:23:26.245007 IP rpi-garage.home.intra.webmin > domoticz.home.intra.37534: Flags [.], ack 10, win 227, options [nop,nop,TS val 172279517 ecr 17576406], length 0
08:23:26.279421 IP rpi-garage.home.intra.webmin > domoticz.home.intra.37534: Flags [P.], seq 93:106, ack 10, win 227, options [nop,nop,TS val 172279521 ecr 17576406], length 13
08:23:26.279440 IP domoticz.home.intra.37534 > rpi-garage.home.intra.webmin: Flags [.], ack 106, win 229, options [nop,nop,TS val 17576416 ecr 172279521], length 0
08:23:29.527688 IP domoticz.home.intra > rpi-garage.home.intra: ICMP echo request, id 2992, seq 1, length 27
08:23:29.529126 IP rpi-garage.home.intra > domoticz.home.intra: ICMP echo reply, id 2992, seq 1, length 27
^C
44 packets captured
48 packets received by filter
0 packets dropped by kernel
dennis@domoticz:~$

What I see:
The ICMP traffic is the keepalive checker in Domoticz. So this seems to be working.. ;-)

During the "RFLink: trying to connect to rpi-garage.home.intra:10000" before the workaround, no traffic on port 10000 (configured in ser2net) is initiated from the Domoticz server towards the RFLink over LAN.  All traffic on port 10000 is initiated by the RFLink and a lower network level response is given.

You can see for example in the logging that it says it checking for the RFlink on 2016-08-08 08:22:18.061. But the first non-ICMP traffic which you see is on 08:22:28.354096 and this traffic is sent by the RFLink (named rpi-garage.home.intra). And just to clarify: The tcpdump and domoticz are running on the same machine, so a 10 seconds time difference is not possible.. ;-)

Then I reset the connection via the mentioned "workaround":
Dommoticz:
2016-08-08 08:23:08.067 RFLink: TCP/IP Worker stopped...
2016-08-08 08:23:25.238 RFLink: trying to connect to rpi-garage.home.intra:10000

tcpdump:
08:23:08.080089 IP domoticz.home.intra.53042 > rpi-garage.home.intra.webmin: Flags [R.], seq 1, ack 129, win 237, options [nop,nop,TS val 17571863 ecr 172277229], length 0
<...>
08:23:25.244555 IP domoticz.home.intra.37534 > rpi-garage.home.intra.webmin: Flags [S], seq 3168533619, win 29200, options [mss 1460,sackOK,TS val 17576156 ecr 0,nop,wscale 7], length 0
08:23:25.244645 IP rpi-garage.home.intra.webmin > domoticz.home.intra.37534: Flags [S.], seq 3802273918, ack 3168533620, win 28960, options [mss 1460,sackOK,TS val 172279417 ecr 17576156,nop,wscale 7], length 0
08:23:25.247001 IP domoticz.home.intra.37534 > rpi-garage.home.intra.webmin: Flags [.], ack 1, win 229, options [nop,nop,TS val 17576158 ecr 172279417], length 0

So at 08:23:08 Domoticz sent a reset packet (with the flag [R]). Then at 08:23:25 you see a SYN, SYN/ACK, ACK running between the Domoticz server and the RFLink over LAN.

From that point on also the Domoticz machine starts sending packets towards port 10000 every 20 seconds (probably some sort of keepalive) as you can see for example at timestamp 08:23:26.245840.

I monitored the tcpdump session for a while now and the Domoticz server now keeps sending traffic towards the RFLink on port 10000 (and not only waiting anymore):

08:53:24.494501 IP domoticz.home.intra.37534 > rpi-garage.home.intra.webmin: Flags [P.], seq 379:388, ack 2722, win 229, options [nop,nop,TS val 18025970 ecr 172459232], length 9
08:53:24.501140 IP rpi-garage.home.intra.webmin > domoticz.home.intra.37534: Flags [.], ack 388, win 227, options [nop,nop,TS val 172459343 ecr 18025970], length 0
<...>
08:53:44.497171 IP domoticz.home.intra.37534 > rpi-garage.home.intra.webmin: Flags [P.], seq 388:397, ack 2778, win 229, options [nop,nop,TS val 18030971 ecr 172460215], length 9
08:53:44.532078 IP rpi-garage.home.intra.webmin > domoticz.home.intra.37534: Flags [.], ack 397, win 227, options [nop,nop,TS val 172461344 ecr 18030971], length 0
<...>
08:54:04.499995 IP domoticz.home.intra.37534 > rpi-garage.home.intra.webmin: Flags [P.], seq 397:406, ack 2834, win 229, options [nop,nop,TS val 18035972 ecr 172462732], length 9
08:54:04.540449 IP rpi-garage.home.intra.webmin > domoticz.home.intra.37534: Flags [.], ack 406, win 227, options [nop,nop,TS val 172463347 ecr 18035972], length 0
<...>
08:54:24.502784 IP domoticz.home.intra.37534 > rpi-garage.home.intra.webmin: Flags [P.], seq 406:415, ack 2890, win 229, options [nop,nop,TS val 18040972 ecr 172463715], length 9
08:54:24.507664 IP rpi-garage.home.intra.webmin > domoticz.home.intra.37534: Flags [.], ack 415, win 227, options [nop,nop,TS val 172465344 ecr 18040972], length 0
<...>
08:54:44.505746 IP domoticz.home.intra.37534 > rpi-garage.home.intra.webmin: Flags [P.], seq 415:424, ack 2989, win 229, options [nop,nop,TS val 18045973 ecr 172467215], length 9
08:54:44.510226 IP rpi-garage.home.intra.webmin > domoticz.home.intra.37534: Flags [.], ack 424, win 227, options [nop,nop,TS val 172467344 ecr 18045973], length 0
<...>
08:55:04.508506 IP domoticz.home.intra.37534 > rpi-garage.home.intra.webmin: Flags [P.], seq 424:433, ack 3002, win 229, options [nop,nop,TS val 18050974 ecr 172467348], length 9
08:55:04.513923 IP rpi-garage.home.intra.webmin > domoticz.home.intra.37534: Flags [.], ack 433, win 227, options [nop,nop,TS val 172469344 ecr 18050974], length 0

**Comment by ldrolez** [comment]
In your first tcpdump, I see that domoticz and your rflink are still connected, but for a strange reason, domoticz did not reset the old connexion, before trying to initiate a new one.

**Comment by Whizzzer** [comment]
You are correct on the connected part.. It's what I also said after the first TCPdump: "no traffic on port 10000 (configured in ser2net) is initiated from the Domoticz server towards the RFLink over LAN. All traffic on port 10000 is initiated by the RFLink and a lower network level response is given."

While afterwards or when the connection is ok: "From that point on also the Domoticz machine starts sending packets towards port 10000 every 20 seconds (probably some sort of keepalive)"

But when it's in the faulty state, it does not reset it's connection on a TCP level. It does however respond to packets coming from the RFLink over LAN. The TCP session is still there (otherwise it would not ACK, but send a reset) on a "system level", but Domoticz itself thinks it isn't.

So maybe (but I'm not a coding guy) a (temporarily) solution would be to reset or tear down any TCP connections with the RFlink over LAN before trying to connect again.

**Comment by KlaasVvaak** [comment]
I have exact the same 'reconnect after network interruption' problem as described by Whizzzer, using Domoticz v8153. Is there a solution available?

**Comment by gizmocuz** [comment]
@KlaasVvaak , you are responding to a thread from 2016, we are at version 8900+ now.
Best to look into the RFLinkTCP and ASyncTCP classes

**Comment by ghost** [comment]
I had the same issue and this thread is the first hit by googling it. I could resolve it after another 30 minutes with google..... 
"Best to look into the RFLinkTCP and ASyncTCP classes" was not a good hint, sorry. 

To solve this issue:
Set the data timeout in hardware-section to 1 minute. If domoticz loose the connection it reconnects after 1 minute by restarting the tcp connection.

Im using v3.8770

**Comment by gizmocuz** [comment]
@davincino , no, it means, when no data is received for 1 minute, it will restart.
So if you only have for example light switches, do not set this to 1 as no data is received
Or if you have sensors that will only transmit the current status every 3 minutes, set it to 4

**Comment by ghost** [comment]
I see 'pong' from rflink every 30 seconds. Is the pong enough for 'data received' acknowledgment?

**Comment by gizmocuz** [comment]
Yes it does indeed !
